<?xml version="1.0" encoding="UTF-8"?>
<schema xmlns="http://www.w3.org/2001/XMLSchema"
	targetNamespace="http://praveenorugantitech.blogspot.com/Patient"
	xmlns:tns="http://praveenorugantitech.blogspot.com/Patient"
	elementFormDefault="qualified">
	<element name="Patient" type="tns:Patient" />
	<complexType name="Patient">
		<sequence>
			<element name="Name" type="tns:String15Chars" />
			<element name="Age" type="int" />
			<element name="DOB" type="date" />
			<element name="Email" type="string" maxOccurs="unbounded" />
			<element name="Gender" type="tns:Gender" />
			<element name="Phone" type="string" maxOccurs="2" />
			<element name="payment" type="tns:PaymentType" />
		</sequence>
		<attribute name="id" type="tns:ID"></attribute>
	</complexType>
	<complexType name="PaymentType">
		<choice>
			<element name="cash" type="int"></element>
			<element name="insurance" type="tns:Insurance"></element>
		</choice>
	</complexType>
	<complexType name="Insurance">
		<all>
			<element name="provider" type="string" />
			<element name="limit" type="int" />
		</all>
	</complexType>
	<simpleType name="ID">
		<restriction base="int">
			<pattern value="[0-9]" />
		</restriction>
	</simpleType>
	<simpleType name="String15Chars">
		<restriction base="string">
			<maxLength value="15" />
		</restriction>
	</simpleType>
	<simpleType name="Gender">
		<restriction base="string">
			<enumeration value="M" />
			<enumeration value="F" />
		</restriction>
	</simpleType>
</schema>